{
  "schema_version": "contextsafe.mapping-profile/1.0.0",
  "profile_id": "MAP-REFERENCE-FHIR-R4-JSON",
  "format": "fhir-r4-json",
  "version": "0.1.0",
  "review": {
    "status": "not_reviewed",
    "reviewed_by": null,
    "reviewed_at": null
  },
  "rows": [
    {
      "source": {
        "concept": "gender_identity",
        "carrier": "http://hl7.org/fhir/StructureDefinition/individual-genderIdentity",
        "token": "CSYN-GENDER-1"
      },
      "target": {
        "concept": "gender_identity",
        "value": {
          "status": "specified",
          "value": "fixture-gender-1",
          "code_system": "urn:contextsafe:fixture"
        }
      }
    },
    {
      "source": {
        "concept": "pronouns",
        "carrier": "http://hl7.org/fhir/StructureDefinition/individual-pronouns",
        "token": "CSYN-PRONOUN-THEY-THEM"
      },
      "target": {
        "concept": "pronouns",
        "value": {"status": "specified", "value": "they/them"}
      }
    },
    {
      "source": {
        "concept": "recorded_sex_or_gender",
        "carrier": "http://hl7.org/fhir/StructureDefinition/individual-recordedSexOrGender",
        "token": "X"
      },
      "target": {
        "concept": "recorded_sex_or_gender",
        "value": {"value": "X", "context": "government-id", "source": "synthetic-fixture"}
      }
    },
    {
      "source": {
        "concept": "name_to_use",
        "carrier": "Patient.name",
        "token": "CSYN-ASTER"
      },
      "target": {
        "concept": "name_to_use",
        "value": {"status": "specified", "value": "CSYN-ASTER", "use": "usual"}
      }
    }
  ]
}
